<?xml version="1.0" ?><programa xmlns="http://www.example.org/ejercicio2" xmlns:xsi="http://www.w3.org/2001/XMLSchema-instance" xsi:schemaLocation="http://www.example.org/ejercicio2 ejercicio2.xsd" identificador="aguila-roja"><nombre>Águila Roja</nombre><url-programa>/m/alacarta/videos/aguila-roja/?media=tve</url-programa><url-portada>http://img.rtve.es/imagenes/aguila-roja/1412769760573.png</url-portada><emision><titulo>T9 - Capítulo 116</titulo><fecha>2016-10-27</fecha><tiempo-emision>1:27:40</tiempo-emision><url-emision>/m/alacarta/videos/aguila-roja/aguila-roja-t9-capitulo-116/3771566/?media=tve</url-emision></emision><emision><titulo>T9 - Capítulo 115</titulo><fecha>2016-10-20</fecha><tiempo-emision>1:21:25</tiempo-emision><url-emision>/m/alacarta/videos/aguila-roja/aguila-roja-t9-capitulo-115/3763280/?media=tve</url-emision></emision><emision><titulo>T9 - Capítulo 114</titulo><fecha>2016-10-13</fecha><tiempo-emision>1:16:39</tiempo-emision><url-emision>/m/alacarta/videos/aguila-roja/aguila-roja-t9-capitulo-114/3752919/?media=tve</url-emision></emision><emision><titulo>T9 - Capítulo 113</titulo><fecha>2016-10-06</fecha><tiempo-emision>1:18:45</tiempo-emision><url-emision>/m/alacarta/videos/aguila-roja/aguila-roja-t9-capitulo-113/3745187/?media=tve</url-emision></emision><emision><titulo>T9 - Capítulo 112</titulo><fecha>2016-09-29</fecha><tiempo-emision>1:18:43</tiempo-emision><url-emision>/m/alacarta/videos/aguila-roja/aguila-roja-t9-capitulo-112/3736718/?media=tve</url-emision></emision><emision><titulo>T9 - Capítulo 111</titulo><fecha>2016-09-22</fecha><tiempo-emision>1:19:10</tiempo-emision><url-emision>/m/alacarta/videos/aguila-roja/aguila-roja-t9-capitulo-111/3728076/?media=tve</url-emision></emision><emision><titulo>T9 - Capítulo 110</titulo><fecha>2016-09-15</fecha><tiempo-emision>1:18:11</tiempo-emision><url-emision>/m/alacarta/videos/aguila-roja/aguila-roja-t9-capitulo-110/3719743/?media=tve</url-emision></emision><emision><titulo>T9 - Capítulo 109</titulo><fecha>2016-07-19</fecha><tiempo-emision>1:19:07</tiempo-emision><url-emision>/m/alacarta/videos/aguila-roja/aguila-roja-t9-capitulo-109/3664155/?media=tve</url-emision></emision></programa>